Title,URL,Company,Content
Python Web Developer,https://hh.ru/vacancy/34831657?query=python, Soshace,Guarantee of regular payments and reliable clients. We search for clients and do all the paperwork. After the first project... 3+ years of professional software development experience with Python. 1+ year of professional experience with Django. 
Full-stack (Django+React) Developer,https://hh.ru/vacancy/35564583?query=python,ООО Limestone Digital,"Work in the international team of professionals who provide solutions in the Finance sphere. The idea of this particular project... At least 1 year of experience with Django. - Strong knowledge of Python (2, 3), Django. - Good knowledge and understanding of..."
Middle-Senior Python Developer,https://hh.ru/vacancy/35493005?query=python, J2 Cloud Services LLC,"As a member of an agile project team, work closely with Product Development, Operations, and other QA team members as... Familiarity with Atlassian suite (JIRA, Confluence). Experience with Python 3. Experience with Go. Knowledge and experience with containers, container orchestration..."
Junior / Middle Data Analyst,https://hh.ru/vacancy/35838391?query=python," FOZZY GROUP, Корпорация","Interpreting and translating business problems into analytical solutions for optimization and development of Workforce Planning model. Involvement in the entire... Willingness to learn, professionalism and dedication, able to work under pressure. Python (at least numpy, pandas, sklearn, pulp). "
Аналітик SQL,https://hh.ru/vacancy/35588732?query=python," FOZZY GROUP, Корпорация","Генерація звітів різного рівня складності. Робота з великим масивом даних. Комунікація із суміжними відділами в рамках вирішення робочих завдань.  Знання SQL. Знання мов програмування (Python, R) - буде перевагою. Бажання розвиватися і досягати поставлених цілей. Уважність, відповідальність. Аналітичний склад розуму."
Senior C/C++ Developer,https://hh.ru/vacancy/35411378?query=python, Фортуна,"Ведение проектов создания программно-аппаратных комплексов, программирование на разных уровнях для разных платформ (C, С++, Python, Karel). Написание кода для... Инициатива, желание учиться, в том числе самостоятельно, способность воспринимать большие объемы технической информации. Python — базовое понимание структур данных. "
Программист Python,https://hh.ru/vacancy/35157801?query=python,ООО Тензор,По разработке и поддержке собственной высоконагруженной картографической системы и связанных продуктов. Знание Python. Опыт работы с базами данных. Опыт коммерческой разработки. Понимание принципов ООП. Опыт разработки высоконагруженных систем. Опыт кроссплатформенной разработки.
Senior data scientist,https://hh.ru/vacancy/33813977?query=python, Vodafone Украина,"Робота з базами даних. Сегментація, кластеризація абонентів. Моделювання (supervised, unsupervised). Поведінковий аналіз абонентів. Аналіз даних з метою отримання з них... Досвід роботи більше 2-х років з Python/R (статистичні та ML пакети). Глибоке розуміння і досвід застосування алгоритмів і..."
Junior Automation QA Engineer (Python),https://hh.ru/vacancy/35510785?query=python,ИП JatApp,Performing Test-Operations with JIRA and Jenkins. Analyzing Test Results. Aerating Bug Tickets. Maintaining and developing Test Cases and their... Good understanding of QA automation concepts. Hands-on experience in development of Python test scripts. Working experience with Jenkins. 
Data scientist / Machine Learning Engineer,https://hh.ru/vacancy/35406525?query=python,ООО Moneyveo,"Risk Service is one of the most important services that is responsible for automatic analysis of the client data and... Deep knowledge of the SQL language. Experience with Python libs (Pandas, Numpy, Scipy, Scikit-learn, Flask). Experience with Computer Vision. "
Python Developer,https://hh.ru/vacancy/35632860?query=python," Альфа-Банк, Украина",Чим потрібно займатись на даній позиції: Брати участь у розробці нових та доробці існуючих інтеграційних компонентів на базі технологій Big... Must have: Знання фреймворку Spark: Kerberos.
Middle / Senior Python Developer,https://hh.ru/vacancy/35510661?query=python,ИП JatApp,Developing new custom functionality and libraries. Adopting new libraries and technologies. Extending and maintaining the product framework. 2 yrs+ of hands on experience with Python. Good grasp in OOP and software design. Big appetite to write clean...
Python / Django Developer,https://hh.ru/vacancy/35422139?query=python,ООО E-book Applications,"The Full-Stack Software Engineer will deliver a key technology component for a learning platform. This candidate should be able... Technical Skills: 3-5 years of professional development experience. Experience with Git/Bitbucket. The ideal candidate will be dedicated, demonstrate..."
Junior statistical programmer in Python and R (CRAN),https://hh.ru/vacancy/35872679?query=python,ООО Домінант Фарма,"Оплата почасовая в зависимости от уровня знаний. Пересылаю через Вестерн Юнион. Учет часов ведете в гугл-шит файле, ежедневно отмечая... Знать хотя бы один из продуктов - R (CRAN), Matlab, Python, Mathematica. Образование или текущее обучение в одной из дисциплин: математике..."
Python Developer,https://hh.ru/vacancy/35184454?query=python, Syntech Software,"Writing reusable, testable, and efficient code. Writing RESTful APIs. Integration of user-facing elements developed by front-end developers with... Basic understanding of Unix system. Strong knowledge of Python. Strong knowledge of Django and experience in work with the related..."
Senior Python Developer (to Riga),https://hh.ru/vacancy/35713338?query=python, Betby,"Писать web-сервисы и их компоненты. Работать с самыми новыми фреймворками. Вести документацию. Опыт с Python не менее 3х лет - важно. Опыт асинхронного программирования(особенно полезен опыт работы с aioamqp, aiohttp). "
Python+Java Web Developer,https://hh.ru/vacancy/35496002?query=python,ООО ФЛП Воронова И.Н.,A creative problem solver. You can craft a solution using both custom development and purchased applications. Work well both independently... Understanding of code best practices and standards. Experience writing Python requisites or test cases is a plus. Experience working with...
Middle Python Developer,https://hh.ru/vacancy/35555362?query=python,ИП Импульс,Разработка и доработка модулей используемой CRM-системы. Настройка и интеграция CRM-системы с другими системами. Поддержка созданных проектов.  Минимум год (два года) коммерческого опыта разработки на Python. Опыт web-разработки. Опыт AWS S3. Опыт работы с системами...
DevOps Engineer,https://hh.ru/vacancy/35872430?query=python,ООО Whaleapp, Знание Docker/k8s. Будет плюсом: Знание языков программирования Python/C#/Javascript. Опыт работы в игровой индустрии.
Data Engineer (Digital),https://hh.ru/vacancy/35659033?query=python, Exness,"Calculate costs and revenue from all paid media by combining multiple data sources. Integrating with paid networks (Facebook, Google, Twitter... 3-5 Years experience with SQL and Python. Experience building Data pipelines. Experience with with Javascript and PHP is a..."
Python Web Developer,https://hh.ru/vacancy/34831657?query=python, Soshace,Guarantee of regular payments and reliable clients. We search for clients and do all the paperwork. After the first project... 3+ years of professional software development experience with Python. 1+ year of professional experience with Django. 
Full-stack (Django+React) Developer,https://hh.ru/vacancy/35564583?query=python,ООО Limestone Digital,"Work in the international team of professionals who provide solutions in the Finance sphere. The idea of this particular project... At least 1 year of experience with Django. - Strong knowledge of Python (2, 3), Django. - Good knowledge and understanding of..."
Middle-Senior Python Developer,https://hh.ru/vacancy/35493005?query=python, J2 Cloud Services LLC,"As a member of an agile project team, work closely with Product Development, Operations, and other QA team members as... Familiarity with Atlassian suite (JIRA, Confluence). Experience with Python 3. Experience with Go. Knowledge and experience with containers, container orchestration..."
Junior / Middle Data Analyst,https://hh.ru/vacancy/35838391?query=python," FOZZY GROUP, Корпорация","Interpreting and translating business problems into analytical solutions for optimization and development of Workforce Planning model. Involvement in the entire... Willingness to learn, professionalism and dedication, able to work under pressure. Python (at least numpy, pandas, sklearn, pulp). "
Аналітик SQL,https://hh.ru/vacancy/35588732?query=python," FOZZY GROUP, Корпорация","Генерація звітів різного рівня складності. Робота з великим масивом даних. Комунікація із суміжними відділами в рамках вирішення робочих завдань.  Знання SQL. Знання мов програмування (Python, R) - буде перевагою. Бажання розвиватися і досягати поставлених цілей. Уважність, відповідальність. Аналітичний склад розуму."
Senior C/C++ Developer,https://hh.ru/vacancy/35411378?query=python, Фортуна,"Ведение проектов создания программно-аппаратных комплексов, программирование на разных уровнях для разных платформ (C, С++, Python, Karel). Написание кода для... Инициатива, желание учиться, в том числе самостоятельно, способность воспринимать большие объемы технической информации. Python — базовое понимание структур данных. "
Программист Python,https://hh.ru/vacancy/35157801?query=python,ООО Тензор,По разработке и поддержке собственной высоконагруженной картографической системы и связанных продуктов. Знание Python. Опыт работы с базами данных. Опыт коммерческой разработки. Понимание принципов ООП. Опыт разработки высоконагруженных систем. Опыт кроссплатформенной разработки.
Senior data scientist,https://hh.ru/vacancy/33813977?query=python, Vodafone Украина,"Робота з базами даних. Сегментація, кластеризація абонентів. Моделювання (supervised, unsupervised). Поведінковий аналіз абонентів. Аналіз даних з метою отримання з них... Досвід роботи більше 2-х років з Python/R (статистичні та ML пакети). Глибоке розуміння і досвід застосування алгоритмів і..."
Junior Automation QA Engineer (Python),https://hh.ru/vacancy/35510785?query=python,ИП JatApp,Performing Test-Operations with JIRA and Jenkins. Analyzing Test Results. Aerating Bug Tickets. Maintaining and developing Test Cases and their... Good understanding of QA automation concepts. Hands-on experience in development of Python test scripts. Working experience with Jenkins. 
Data scientist / Machine Learning Engineer,https://hh.ru/vacancy/35406525?query=python,ООО Moneyveo,"Risk Service is one of the most important services that is responsible for automatic analysis of the client data and... Deep knowledge of the SQL language. Experience with Python libs (Pandas, Numpy, Scipy, Scikit-learn, Flask). Experience with Computer Vision. "
Python Developer,https://hh.ru/vacancy/35632860?query=python," Альфа-Банк, Украина",Чим потрібно займатись на даній позиції: Брати участь у розробці нових та доробці існуючих інтеграційних компонентів на базі технологій Big... Must have: Знання фреймворку Spark: Kerberos.
Middle / Senior Python Developer,https://hh.ru/vacancy/35510661?query=python,ИП JatApp,Developing new custom functionality and libraries. Adopting new libraries and technologies. Extending and maintaining the product framework. 2 yrs+ of hands on experience with Python. Good grasp in OOP and software design. Big appetite to write clean...
Python / Django Developer,https://hh.ru/vacancy/35422139?query=python,ООО E-book Applications,"The Full-Stack Software Engineer will deliver a key technology component for a learning platform. This candidate should be able... Technical Skills: 3-5 years of professional development experience. Experience with Git/Bitbucket. The ideal candidate will be dedicated, demonstrate..."
Junior statistical programmer in Python and R (CRAN),https://hh.ru/vacancy/35872679?query=python,ООО Домінант Фарма,"Оплата почасовая в зависимости от уровня знаний. Пересылаю через Вестерн Юнион. Учет часов ведете в гугл-шит файле, ежедневно отмечая... Знать хотя бы один из продуктов - R (CRAN), Matlab, Python, Mathematica. Образование или текущее обучение в одной из дисциплин: математике..."
Python Developer,https://hh.ru/vacancy/35184454?query=python, Syntech Software,"Writing reusable, testable, and efficient code. Writing RESTful APIs. Integration of user-facing elements developed by front-end developers with... Basic understanding of Unix system. Strong knowledge of Python. Strong knowledge of Django and experience in work with the related..."
Senior Python Developer (to Riga),https://hh.ru/vacancy/35713338?query=python, Betby,"Писать web-сервисы и их компоненты. Работать с самыми новыми фреймворками. Вести документацию. Опыт с Python не менее 3х лет - важно. Опыт асинхронного программирования(особенно полезен опыт работы с aioamqp, aiohttp). "
Python+Java Web Developer,https://hh.ru/vacancy/35496002?query=python,ООО ФЛП Воронова И.Н.,A creative problem solver. You can craft a solution using both custom development and purchased applications. Work well both independently... Understanding of code best practices and standards. Experience writing Python requisites or test cases is a plus. Experience working with...
Middle Python Developer,https://hh.ru/vacancy/35555362?query=python,ИП Импульс,Разработка и доработка модулей используемой CRM-системы. Настройка и интеграция CRM-системы с другими системами. Поддержка созданных проектов.  Минимум год (два года) коммерческого опыта разработки на Python. Опыт web-разработки. Опыт AWS S3. Опыт работы с системами...
DevOps Engineer,https://hh.ru/vacancy/35872430?query=python,ООО Whaleapp, Знание Docker/k8s. Будет плюсом: Знание языков программирования Python/C#/Javascript. Опыт работы в игровой индустрии.
Data Engineer (Digital),https://hh.ru/vacancy/35659033?query=python, Exness,"Calculate costs and revenue from all paid media by combining multiple data sources. Integrating with paid networks (Facebook, Google, Twitter... 3-5 Years experience with SQL and Python. Experience building Data pipelines. Experience with with Javascript and PHP is a..."
L2 Support Engineer / Junior DevOps Engineer,https://hh.ru/vacancy/35470441?query=python, PMLAB,"Support of logging and monitoring tools. Setting up monitoring for servers and services. Troubleshooting of services, suggestions for its optimization... Apprenticeship with relevant work experience in a high scale and complex environments. Scripting (bash, Python, Go). Knowledge of Nomad, Consul. "
Backend Developer,https://hh.ru/vacancy/35872149?query=python,ООО Whaleapp,"Разработка бизнес-логики и back-end систем для поддержки продуктов компании. Знание одного из языков программирования (NodeJS, Golang или Python). SQL (PL/pgSQL/T-Sql), No-SQL (MongoDB/Redis). "
Senior Python QA Automation Engineer (Switch Products),https://hh.ru/vacancy/32825027?query=python, Ubiquiti,"Deliver new upcoming Unifi switch product. Design, develop and execute automation. Monitor test results for software quality. Investigate testbed issues... 3 years of software testing experience, at least 1 year of QA Automation using Python. Strong experience in Python, REST..."
Aspose.PSD Cloud .NET backend developer,https://hh.ru/vacancy/35659227?query=python, Aspose,"Web applications back-end development. Docker containers integration and usage. Micro-services design and development. Regular salary reviews based on... Desirable skills: Experience developing Web API. Proven development experience with some of : Java, Ruby, Python, Swift, Perl, Go. "
Network QA Engineer,https://hh.ru/vacancy/35160615?query=python, Ubiquiti,"Ubiquiti Inc is an American technology company started in 2005. Based in New York, NY, Ubiquiti manufactures wireless data communication... Will be a plus: Experience with QA Automation in Python. Experience with Python test frameworks (Robot / PyTest / unittest etc.). "
Начальник відділу аналітики даних Управління моделювання ризиків (скормейкер),https://hh.ru/vacancy/35561394?query=python, Укргазбанк,"Отримання даних з внутрішніх ресурсів з допомогою SQL запитів. Обробка даних для цілей статистичного аналізу (descriptive and inferential).  ...СУБД MS SQL, MS Office: Excel (VBA, зведені таблиці, формули). Знання і практичні навички роботи з мовами програмування R/Python."
Continuous Integration / Automation Engineer for KernelCare [Remote],https://hh.ru/vacancy/35455387?query=python, Cloud Linux,"Collaborate with kernel engineers, support engineers, python engineers. Communicate with stakeholders and other key business and engineering teams.  Extensive experience in integrating and deploying complex testing environments. Scripting in Python/Shell Scripting. A real problem solver who can..."
Программист PHP / Full Stack (Севастополь),https://hh.ru/vacancy/35906370?query=python, ForexTime Ltd,"Предлагаемая позиция предполагает работу над внутренними сервисами (CRM-системами, системами отчетности), внешними сервисами компании (личный кабинет, вебсайт), а также сопутствующим... ...знание Javascript на уровне ""делал что-то на jquery"", опыт ExtJS будет большим плюсом. Опыт с Java, Go или Python."
QA team leader,https://hh.ru/vacancy/35673698?query=python, SATEC LTD,"Design an automation environment for our web application. Manage the creation of large scale of STP documents based on specification... Bachelor's degree in software engineering, computer science or programming. Rich experience with Python, JS, HTML, Selenium, and API methodologies. "
Kernel Developer for KernelCare,https://hh.ru/vacancy/35904096?query=python, Cloud Linux,"Kernel Developer for KernelCare [Remote]. By applying for this position, you agree with Cloudlinux Privacy Policy and give us your... Effective written and verbal communication. Excellent interpersonal and teamwork skills. Experience with python, shell scripting. Experience with Jenkins."
Преподаватель IT-школы,https://hh.ru/vacancy/35658757?query=python," FOZZY GROUP, Корпорация","Составление и обновление внутренних учебных планов для разработчиков по направлению hard-skills: C#, .net, JavaScript, Pythhon, Angular. Ведение базы внешних... Высшее техническое образование. Знание одного из языков C#, JavaScript, Pythhon, Angular на высоком уровне. В идеале, нескольких языков. "
"С Developer (embedded background), KernelCare Project",https://hh.ru/vacancy/35904296?query=python, Cloud Linux,"By applying for this position, you agree with Cloudlinux Privacy Policy and give us your consent to maintain and process... Effective written and verbal communication. Excellent interpersonal and teamwork skills. Experience with python, shell scripting. Experience with Jenkins."
Бизнес Аналитик (Севастополь),https://hh.ru/vacancy/35907065?query=python, ForexTime Ltd,"Выполнять анализ бизнес-запросов, собирать, уточнять и документировать требования. Трансформация бизнес-требования в технические спецификации для команды разработчиков.  Аналитический склад ума. Умение структурировать информацию, четко представлять ее для разных аудиторий, оценивать важность и актуальность запросов. Опыт общения с..."
Системный администратор NOC центра,https://hh.ru/vacancy/35804165?query=python,ООО Вебкон," Опыт администрирования СУБД MySQL. Умение разобраться в скриптах PERL, PHP, shell, Python. Способность и желание быстро и самостоятельно обучаться. "
Software Tester / Automated Test Engineer (Cyprus),https://hh.ru/vacancy/35900232?query=python,ООО Spotware Systems Ltd,"Writing and executing automated tests for our APIs. Run manual GUI, API and performance tests. Work with users bug reports. Knowledge of .NET, C# or any other similar language as Java, Python, Golang. Well-developed analytical and problem-solving skills. "
Scala Developer (Java / C++ / С# / Python),https://hh.ru/vacancy/34551089?query=python, NAUMEN,"Мы поддерживаем развитие ИТ-сообщества и обмен опытом: участвуем во внешних и внутренних конференциях не только в качестве слушателя, но... Опыт промышленной разработки на одном из высокоуровневых языков: Scala, Java, C#, Python и др.. Знание ключевых методологий и паттернов разработки..."
Senior QA Automation Engineer,https://hh.ru/vacancy/35790946?query=python,ООО Overonix Technologies,"Technologies we use: Groovy, Geb, Selenium, Spock, Gatling. Estimate, plan, and execute testing activities. Develop detailed, comprehensive and well-structured... Solid scripting skills such as: Groovy, Python, Shell (Bash). Strong Knowledge of Networking and (Monitoring: Prometeus/CloudWatch/ELK etc.). "
