Title,URL,Company,ContentC++ Online Programmer,https://hh.ru/vacancy/35895497?query=python, Ubisoft Ukraine,"Design, prototype, and implement the services that will be offered in the game while keeping high scalability, availability and security... Strong knowledge of Python and C++ programming. Experience working with client-server architecture, web server technology and protocols, web services. "
Web-программист (WebGl+Three.js),https://hh.ru/vacancy/35886549?query=python,ООО 3D Source,Создание и поддержка 3D-конфигураторов. Работа с командой R & D над новыми технологиями / подходами. Angular 2+ (6/7) или React.js или Vue.js. WebGL (+ three.js). REST API. GIT. Php. Python. Минимум технический уровень...
Analyst SQL,https://hh.ru/vacancy/35773379?query=python,"ООО ДІНЕРО, ФК","Аналитика с высокой добавленной стоимостью (качество и скорость доставки информации для обеспечения полной поддержки бизнеса: поддержка клиентов, сбор долгов, портфель... Высшее образование (математика, IT) желательно. Отличное знание SQL, Excel (> 3 года практического опыта), знание VBA и BI будет преимуществом. "
Data Architect relocation to Europe,https://hh.ru/vacancy/35875127?query=python,ИП My HR,"Analyze and qualify the needs and business issues of our clients. Define and implement data architectures adapted to the conditions... Appreciated: Azure Datalake, Azure SQL Database, Azure Analysis Services, Azure HD Insight, Azure Stream Analytics, Power BI, Python, R, Machine..."
Senior Java Developer,https://hh.ru/vacancy/34960114?query=python, Codeminders," ...set is any of followings: MS Lync/Skype for Business Server, Cisco CUPs or WebEx Server. Groovy, Python, C/C++."
Senior RF software engineer,https://hh.ru/vacancy/35021160?query=python, Ubiquiti,"Ubiquiti Inc is an American technology company started in 2005. Based in New York, NY, Ubiquiti manufactures wireless data communication... Experience with bash shell scripting and/or Python. Effective written and verbal communication skills (ENGLISH MANDATORY). Will be a plus..."
Wireless QA Engineer,https://hh.ru/vacancy/32825002?query=python, Ubiquiti,"Ubiquiti Inc is an American technology company started in 2005. Based in New York, NY, Ubiquiti manufactures wireless data communication... Experience with bash shell scripting and/or Python. BS degree in Computer Science, or related engineering degree. Effective written and..."
Marketing Analyst,https://hh.ru/vacancy/35830367?query=python, KIVORK,"Проверять гипотезы (формирование, тестирование, оценка результата). Составлять отчеты и анализировать динамику ключевых метрик продуктов. Разрабатывать метрики, которые помогут определять успех... Опыт автоматизации процессов аналитики (Python/R). Опыт работы с Google Core reporting API, Measurement Protocol. Умение проводить А/Б тесты..."
Financial Risk Modeling Senior Specialist,https://hh.ru/vacancy/35873726?query=python, PwC Украина,"Implementation of interest risk management framework in a bank. Validation of market risk models. Design and implementation of business, operational... Knowledge at least one of the following programming languages: SQL, R, Python or SAS. Very good command of English language..."
FullStack Developer (AI),https://hh.ru/vacancy/35763314?query=python, Terrasoft,"Розробки web-сервісів на .NET Core. Роботи із sql-подібними СУБД. Процесів CI/CD. Технологій Docker та Kubernetes.  ...machine learning, text processing та named-entity recognition (NER) на python. Бажаними є знання та досвід: Інженерних практик (extreme programming..."
Инженер-программист,https://hh.ru/vacancy/35323168?query=python, Корпорация «Проект-техника»,"Разработка веб-интерфейсов продуктов с нуля на React/Redux, Typescript, Bootstrap 4, HTML5, CSS/SASS. Участие в разработке дизайна... Понимание Python, PHP или Node.js. Опыт разработки веб-интерфейсов на технологии react.js не менее 1 года (желательно, обсуждается). "
Senior / Middle Front-End разработчик (Направление решений в образовании),https://hh.ru/vacancy/34949201?query=python, NAUMEN,"Разработка клиентской части web-приложений. Поддержка и рефакторинг существующего фронтенда. Участие в проектировании и выборе методологий реализации web-интерфейсов в... Опыт разработки серверной части web-приложения (на Scala/Java/JS/Python); большим плюсом будет знание языка Scala, фреймворка Play и..."
Senior QA Engineer,https://hh.ru/vacancy/35021148?query=python, Ubiquiti,"Deliver new upcoming Unifi switch product. Design, develop and execute automation. Monitor test results for software quality. Investigate testbed issues... Minimum of years of software testing experience. Good at python and scripting language. Strong knowledge of software QA methodologies, tools..."
Senior Embedded Engineer (Wireless),https://hh.ru/vacancy/35021155?query=python, Ubiquiti,"Ubiquiti Inc is an American technology company started in 2005. Based in New York, NY, Ubiquiti manufactures wireless data communication... Experience with bash shell scripting and/or Python. BS degree in Computer Science, or related engineering degree. Effective written and..."
Informatica Developer,https://hh.ru/vacancy/35093168?query=python, Emergn, Experience in writing scripts for data processing (Bash / Python / PowerShell etc.). Understanding/experience of BigData technologies. Excellent knowledge of SQL...
PHP developer for Imunify Security Project [Remote],https://hh.ru/vacancy/35680656?query=python, Cloud Linux,PHP developer for Imunify Security Project [Remote]. Good knowledge of Python (>=2.7 and 3.*). Shell scripting. Strong Linux knowledge. Experience with cloud computing(Amazon EC2...
Junior Scala Developer (готовы переучивать с Java / C++ / С# / Python),https://hh.ru/vacancy/34550971?query=python, NAUMEN,"Клиент-серверное приложение с использованием HTTP. Написание SQL-запросов и использование ORM. ООП и основные паттерны. Scala хотя бы на... Интересуется программированием и современной разработкой серверных приложений. Хочет дальше развиваться на нашем стеке. Знает английский язык на уровне, достаточном для..."
DevOps Engineer (на Кипр),https://hh.ru/vacancy/35852622?query=python, Wisebits,"Развертывание и поддержка всех серверов проекта(hardware,kvm,docker). Работа с GitLab CI/CD / Kubernetes / Ansible. Работа с Prometheus / ELK... Опыт работы с OpenStack. Опыт работы с видео на больших объемах в кластере: хранение, конвертация, стриминг, CDN. Опыт программирования Python..."
Senior С#/.Net Engineer,https://hh.ru/vacancy/35845718?query=python, OSA HP,Project is an ETL (Extract-Transform-Load) solution. Data providers send data once an hour (CSV files of 70+... KV-DBMS (such as RocksDB). Apache Kafka. Python3. Some stats: 2 TB of warm data. 5000 active users in...
Cyber Security Analyst,https://hh.ru/vacancy/35838752?query=python, Инфопульс,"Monitoring compliance of IT infrastructure nodes with applicable security requirements. Handling security vulnerabilities and risks in the IT environment.  Basic scripting skills (Python, Perl, Bash, etc.). Strong cybersecurity analysis and situational awareness skills. Good command of English, proven writing..."
C / C++ Developer,https://hh.ru/vacancy/35836118?query=python, Zodiac Interactive,"Implementation of projects (information and entertainment services) for interactive television (C++ 17). Embedded software development – including work with requirements specifications... Knowledge of script languages (python, bash, sh). Understanding the basic principles of interprocess communication. Basic knowledge of network programming (POSIX). "
Intern to Actuarial team,https://hh.ru/vacancy/35826066?query=python, Deloitte Ukraine,"Risk and capital modeling/optimization. Acting as the actuarial function for insurance companies. Assisting in due diligence with respect to... Confident in Excel, VBA. Python, R, Prophet or any other programming language is a plus. English level – Upper-Intermediate and..."
Аналітик CVM,https://hh.ru/vacancy/35811495?query=python, Vodafone Украина,"Формування вимог і управління з боку бізнесу впровадженням систем для зберігання, аналізу та візуалізації даних для забезпечення необхідної звітності та... Знання інструментів і методів проведення аналізу, прогнозування. Знання SQL (перевагою буде також знання Python). Розуміння основ data-science (перевагою буде..."
Керівник відділу адміністрування сервісів і систем пост-продакшену,https://hh.ru/vacancy/35802825?query=python, StarLightMedia,"StarLightMedia найбільший медіахолдинг у Східній Європі. Понадполовину українського ТБ-продукту, який ви бачите на екранах,виробляємо саме ми.  Продвинуте знання адміністрування баз даних (MariaDB, Postresql). Продвинуте знання Bash та Python. Знання мереж (TCP/IP, DNS, HTTPS, TLS). "
Аналітик даних,https://hh.ru/vacancy/35305779?query=python, Vodafone Украина,Обробка та аналіз даних для виявлення наявних/потенційних фінансових втрат. Оптимізація та автоматизація робочих процесів. Підготовка разових/періодичних звітів.  Знання SQL на рівні побудови складних запитів. Буде плюсом досвід роботи з Python / R (статистичні та ML пакети). 
BI Developer,https://hh.ru/vacancy/35760918?query=python, Smart Solutions,"Developing and maintaining data warehouse for sales and market data. Dashboards design, development, test and transferring existing solutions to QlikSense.  SQL (MS SQL Server or other RDMS). Python or C# for data processing. Experience in creating data integration and data..."
Engineer (Automation / Load testing),https://hh.ru/vacancy/35734947?query=python," Альфа-Банк, Украина","Чим потрібно займатись на даній позиції: Проведення навантажувального тестування, стрес-тестування та конфігураційного тестування. Збір та аналіз результатів тестування, пошук... Знання однієї з мов програмування (Java / JavaScript / Python). Володіння SQL на рівні написання запитів, робота з збереженими процедурами і т..."
Senior DevOps Engineer,https://hh.ru/vacancy/35732274?query=python, ZiMAD,"Take personal responsibility for the quality, reliability and availability of global IT systems. Maintain day-to-day operations and documentation... Must have strong automation/scripting skills -- proficiency in Python or Ruby is a plus. Experience developing and maintaining technical documentation..."
Full Stack Developer,https://hh.ru/vacancy/35722653?query=python, SportsTraders,"Developing end to end solutions from design to production stages. Working with the tech lead and other team members to... 5+ years of development experience and strong knowledge in the following programming language - JavaScript, Node (MUST), Python (ADVANTAGE). "
"Scala Developer (Java / C++ / С# / Python), г. Севастополь",https://hh.ru/vacancy/34638539?query=python, NAUMEN,"Мы поддерживаем развитие ИТ-сообщества и обмен опытом: участвуем во внешних и внутренних конференциях не только в качестве слушателя, но... Опыт промышленной разработки на одном из высокоуровневых языков: Scala, Java, C#, Python, Go и др.. Опыт работы с базами данных..."
Провідний аналітик,https://hh.ru/vacancy/35726147?query=python, Канал Україна,"Кількісна аналітика соціально-політичного та новинного контенту у різних медіа (випуски новини, соціально-політичні ток-шоу та програми, новинні сайти... Перевагою буде володіння хоча б одним із інструментів : SPSS, R, Google Analytics, Power BI, Google Data Studio, Python. "
Middle Scala Developer,https://hh.ru/vacancy/35537344?query=python,ООО RQ Team (Recruitment Quality Team),"Nightwatch, Spock, ScalaTest. Take an active part in the ongoing processes and product development of the company. Use continuous integration... WILL BE A PLUS: Spring and Spring extensions such as Web, Boot, Security, Data. DevOps experience: Python and BASH scripting..."
Middle Scala Developer (NewAge Solutions Ukraine),https://hh.ru/vacancy/35589430?query=python,ООО RQ Team (Recruitment Quality Team),"Nightwatch, Spock, ScalaTest. Take an active part in the ongoing processes and product development of the company. Use continuous integration... Agile, Scrum, Extreme programming. Will be a plus: DevOps experience: Python and BASH scripting, Experience in troubleshooting production problems, analyzing..."
Team Lead Scala (NewAge Solutions Ukraine),https://hh.ru/vacancy/35354285?query=python,ООО RQ Team (Recruitment Quality Team),"Nightwatch, Spock, ScalaTest. WILL BE A PLUS: Spring and Spring extensions such as Web, Boot, Security, Data. DevOps experience: Python and BASH scripting..."
Senior Data Analyst,https://hh.ru/vacancy/35661240?query=python, Ruby Labs Ltd,"Collect and exploit behavioral data to provide actionable insights to the Product Team and contribute to building the best possible... Full proficiency in SQL, knowledge of Python or R is a plus. Expertise in statistical theory, methods and tools. "
Senior Data Engineer,https://hh.ru/vacancy/35661208?query=python, Ruby Labs Ltd,"Support and develop an analytic infrastructure. Work with data scientists to understand the business problems, proactively design intuitive data structures... Experience on database development, management and ETL. Experience with analytic scripting R, Python and strong with SQL. Passionate, articulate and..."
Администратор системы,https://hh.ru/vacancy/35219882?query=python, Kyivstar,"Обеспечение поддержки пользователей распределенной сети Wi-Fi и проводной сети. Обеспечение поддержки и развития сетевых сервисов компании в датацентрах и... Опыт работы с Unix (RedHat, FreeBSD, Debian, CentOS). Навыки написания скриптов на Python, Bash etc. Знание Best practice решений для..."
Программист С++,https://hh.ru/vacancy/32511577?query=python,ООО Тензор,"Кросс-платформенной разработке мобильного приложения для автоматизации складского учёта. Интеграции Desktop-приложений и облачных сервисов в сфере ЭО и ЭДО. Высшее/неполное высшее образование. Опыт коммерческой разработки на С++. Знание С++11, STL, Boost. Понимание принципов ООП. Знание основных и..."
Kernel Developer for KernelCare Project [Remote],https://hh.ru/vacancy/35678965?query=python, Cloud Linux," Effective written and verbal communication. Excellent interpersonal and teamwork skills. Experience with python, shell scripting. Experience with Jenkins."
GIS Officer,https://hh.ru/vacancy/35660341?query=python,Нек. орг. Філія АКТЕД,"Under the supervision of the GIS/DB Manager and Research Manager, the GIS Officer is responsible for the processes and... Desirable technical qualifications: Data processing and analysis experience using Excel / R / Python (pandas) / Tableau. Experience with Remote Sensing technologies and..."
GIS Assistant,https://hh.ru/vacancy/35660514?query=python,Нек. орг. Філія АКТЕД,"Under the supervision of the IMPACT GIS Officer, the IMPACT GIS Assistant is responsible for the support of the processes... Experience in the area of web development (HTML, CSS, JavaScript, Python) is a strong asset. 1-2 years of experience..."
Middle Web Analyst,https://hh.ru/vacancy/35609633?query=python, PMLAB,"Построение и настройка работы системы web аналитики. Настройка новых событий на сайтах. Проведение и анализ интерфейсных A/B тестов.  Опыт работы с аналитикой App приложений (Firebase, Appsflyer). Опыт работы с Amplitude/Tableau, знание R или Python — будет плюсом."
L2 Support Engineer / Junior DevOps Engineer,https://hh.ru/vacancy/35609069?query=python, PMLAB,"Individual annual training budget with the opportunity to visit paid conferences, training sessions, workshops etc.. — Corporate library and subscriptions for... Scripting (bash, Python, Go). — Knowledge of Nomad, Consul. — Knowledge of GitLab. — Strong troubleshooting skills. — Strong communication skills. — Self-motivated, well..."
Junior DevOps Engineer,https://hh.ru/vacancy/35605090?query=python, PMLAB,"Designing and maintaining High-load and High-availability infrastructure. Analysis of service infrastructure needs and its justification. Performance monitoring.  Apprenticeship with relevant work experience in a high scale and complex environments. Scripting (bash, Python, Go). Strong troubleshooting skills. "
DevOps Engineer,https://hh.ru/vacancy/35565870?query=python," Альфа-Банк, Украина",Чим потрібно займатись на даній позиції: Впроваджувати з подальшим розвитком та супроводженням кластер на базі стеку технологій K8S... Вміння писати та вміння розбирати написані скрипти Bash/Python. Знання принципів контейнеризації та ПЗ (Docker / Podman). Досвід роботи з Kubernetes...
Company Analytics and Data Intelligence Lead,https://hh.ru/vacancy/34156284?query=python,ООО lifecell,"BI Reporting & deep analytics of business. Product Owner for Agile development team. Performance metrics and benchmarking, inform business leaders of... Advanced MS Office user (MS Word, Excel, Access, Power Point) SQL, ORACLE, Python. Oracle Exadata, Hadoop. Strong knowledge of reporting..."
Data / Business Analyst,https://hh.ru/vacancy/35609789?query=python, PMLAB,"Extraction of valuable information from data, making conclusions based on data. — Analysis of stakeholders needs and problems through data. —  Knowledge of SQL. — Knowledge of Python (pandas, numpy, scikit-learn). — Background in Math (probability theory, applied statistics, data analysis). — "
Database Administrator (PostgreSQL),https://hh.ru/vacancy/35589538?query=python, Andersen,"Разработкой и предварительным рассмотрением мониторинга производственных баз данных PostgreSQL. Участвовать в проектировании базы данных, предоставлять рекомендации по улучшению или оптимизации.  Более 3-х лет опыта администрирования и настройки баз данных PostgresSQL. Понимание методов репликации PostgreSQL, дизайна хранилища данных и Amazon..."
Інженер ядра IP-мережі,https://hh.ru/vacancy/35460315?query=python, Vodafone Украина,"Пошук і аналіз інцидентів на мережі, аналіз порушень в роботі протоколів маршрутизації. Автоматизація роботи за допомогою shell, perl, python. Технічної бази мереж передачі даних. Вміння автоматизувати роботу за допомогою shell, perl, python. Вміння працювати з базою даних RIPE. "
Системный администратор,https://hh.ru/vacancy/35411194?query=python,ООО Ikajo,"Сопровождение существующих и запуск новых сервисов IТ-инфраструктуры. — Аудит IТ-инфраструктуры с целью ее оптимизации. — Установка, настройка, администрирование сетевого и... OS: GNU/Linux (CentOS, Fedora). Web Server: Apache, Nginx. Databases: MySQL. Infrastructure Monitoring: Zabbix. Bash. Будет плюсом: Windows and Windows..."
DevOps,https://hh.ru/vacancy/35402078?query=python,ООО SunValley,"Using of new cloud-based technologies and open source tools to implement DevOps processes. Delivering the best quality services and... Programming/scripting skills with at least one of the following languages: PowerShell, Python, Bash. Proven experience with Window or Linux..."
Full-Stack Developer,https://hh.ru/vacancy/35546680?query=python,ООО Eventige,"Full-Stack Developer / eCommerce. You will be developing internal and client-facing web apps, web pages, and using collaborative tools... Frontend (HTML‚ CSS/SASS, JavaScript) Development - 6+ Years. A+ Experience with PHP / Python / Node - 6+ Years. "
Провідний розробник програмного забезпечення,https://hh.ru/vacancy/35444397?query=python, БРСМ-нафта,"Розробка коду в рамках внутрішніх проектів. Виявлення та аналіз вимог замовників. Участь в проектуванні технічних рішень для реалізації нового і... Глибокі знання SQL, T-SQL. Знання JS, AngularJS, HTML, CSS. Знання Python. Перевагою буде досвід роботи із RS-232, USB..."
Junior Software Developer - С [Remote],https://hh.ru/vacancy/35906106?query=python, Cloud Linux,Backporting security patches and adding new features to software like PHP or NodeJS. Create tests. Formulate new and alternate ideas... Desired Skills: Software packaging experience (RPM-based or Debian-based distributions) is a plus. Knowledge of Python is a plus. 
Junior Software Developer - С [Remote],https://hh.ru/vacancy/35906107?query=python, Cloud Linux,Backporting security patches and adding new features to software like PHP or NodeJS. Create tests. Formulate new and alternate ideas... Desired Skills: Software packaging experience (RPM-based or Debian-based distributions) is a plus. Knowledge of Python is a plus. 
Junior Software Developer - С [Remote],https://hh.ru/vacancy/35906108?query=python, Cloud Linux,Backporting security patches and adding new features to software like PHP or NodeJS. Create tests. Formulate new and alternate ideas... Desired Skills: Software packaging experience (RPM-based or Debian-based distributions) is a plus. Knowledge of Python is a plus. 
